<?xml version="1.0" encoding="UTF-8"?>
<class
	xmlns:xsi="http://www.w3.org/2001/XMLSchema-instance" xsi:noNamespaceSchemaLocation="info.xsd">
	<student PRN = "393">
		<firstname>Dinkar</firstname>
		<lastname>Kad</lastname>
		<department>CS</department>
		<CGPA>8.5</CGPA>
		<Intern>TCS</Intern>
	</student>
	<student PRN = "493">
		<firstname>Vaneet</firstname>
		<lastname>Gupta</lastname>
		<department>IT</department>
		<CGPA>9.5</CGPA>
	</student>
	<student PRN = "593">
		<firstname>Jasvir</firstname>
		<lastname>Singh</lastname>
		<department>ENTC</department>
		<CGPA>9.0</CGPA>
	</student>
</class>